indicador,descricao,unidade,recorte,categoria,regra_calculo,limitacoes
total_registros,Quantidade total de linhas no data.frame interim CNES.,registros,geral,geral,nrow(dados_cnes_interim),Não mede estabelecimentos únicos nem qualidade ou completude dos registros.
total_estabelecimentos_distintos,Quantidade de códigos CNES distintos observados.,estabelecimentos,geral,oferta,"Contar valores únicos de co_cnes, desconsiderando NA.",Depende da completude e consistência de co_cnes; não classifica estabelecimentos.
total_municipios_gestores_distintos,Quantidade de municípios gestores distintos observados.,municípios,geral,território,"Contar valores únicos de co_municipio_gestor, desconsiderando NA.",Não valida códigos municipais contra bases territoriais oficiais.
total_competencias_distintas,Quantidade de competências distintas observadas.,competências,geral,temporal,"Contar valores únicos de competencia_aaaamm, desconsiderando NA.",Não avalia continuidade temporal nem ausência de competências intermediárias.
registros_por_competencia,Quantidade de registros por competência válida.,registros,competencia_aaaamm,valor da competência,"Agrupar registros por competencia_aaaamm e contar linhas, ignorando competência NA.",Variações podem refletir carga ou completude dos dados e não mudança real de oferta.
estabelecimentos_distintos_por_municipio_gestor,Quantidade de estabelecimentos distintos por município gestor válido.,estabelecimentos,co_municipio_gestor,código do município gestor,"Agrupar por co_municipio_gestor não ausente e contar co_cnes único, desconsiderando co_cnes NA.",Não mede cobertura populacional, capacidade instalada, leitos ou suficiência de rede.
